{
  "suite_id": "ontology_demo_story_assertions",
  "version": "1.0.0",
  "purpose": "客户 Demo 的确定性剧情标准答案；所有数值均为演示 fixture，不代表客户生产事实。",
  "assumptions": [
    {"id": "DA-01", "statement": "Demo 阈值与模拟数值仅用于展示机制，待真实数据重新标定。", "production_evidence": false},
    {"id": "DA-02", "statement": "R5 的贡献<10%、花费>20%、模型差异<=5%均为 Demo 阈值，待生产数据重新标定。", "production_evidence": false},
    {"id": "DA-03", "statement": "R4 使用截至 as_of 日期的十四日聚合 ROAS 进行判断。", "production_evidence": false},
    {"id": "DA-04", "statement": "客户风险上限参与自动执行或转人工复核的 Demo 门控。", "production_evidence": false},
    {"id": "DA-05", "statement": "G1 与 G2 使用合成动作参数独立演示护栏，不声明由现有规则自然产生。", "production_evidence": false},
    {"id": "DA-06", "statement": "快进分支固定推进十四天，接受分支注入改善结果，拒绝分支保持原分配。", "production_evidence": false}
  ],
  "scenarios": [
    {"assertion_id":"A-R1-POS","title":"R1 高 ACoS 且低 CTR 触发","category":"rule_positive","as_of":"2026-08-14","entity":{"grain":"campaign","id":"campaign_sp_001"},"rule_refs":["R1"],"guardrail_refs":[],"client_id":"demo_client_001","inputs":[{"concept":"acos","value":0.50,"baseline":0.35,"source":"derived_fixture"},{"concept":"ctr","value":0.010,"baseline":0.020,"source":"derived_fixture"}],"expected":{"triggered_rules":["R1"],"action":{"type":"review_creative_and_targeting","param":{"priority":1}},"diagnosis_contains":"创意","disposition":"REVIEW","coverage_status":"MATCH"},"assumption_refs":["DA-01"],"notes":"R1 标准成功场景。"},
    {"assertion_id":"A-R1-NEG-ACOS","title":"R1 仅 ACoS 不达标","category":"rule_negative","as_of":"2026-08-14","entity":{"grain":"campaign","id":"campaign_sp_002"},"rule_refs":["R1"],"guardrail_refs":[],"client_id":"demo_client_001","inputs":[{"concept":"acos","value":0.40,"baseline":0.35,"source":"derived_fixture"},{"concept":"ctr","value":0.010,"baseline":0.020,"source":"derived_fixture"}],"expected":{"triggered_rules":[],"disposition":"NO_ACTION"},"notes":"逐条件破坏 ACoS。"},
    {"assertion_id":"A-R1-NEG-CTR","title":"R1 仅 CTR 不达标","category":"rule_negative","as_of":"2026-08-14","entity":{"grain":"campaign","id":"campaign_sp_003"},"rule_refs":["R1"],"guardrail_refs":[],"client_id":"demo_client_001","inputs":[{"concept":"acos","value":0.50,"baseline":0.35,"source":"derived_fixture"},{"concept":"ctr","value":0.015,"baseline":0.020,"source":"derived_fixture"}],"expected":{"triggered_rules":[],"disposition":"NO_ACTION"},"notes":"逐条件破坏 CTR。"},
    {"assertion_id":"A-R1-BOUNDARY","title":"R1 严格比较等号不触发","category":"rule_boundary","as_of":"2026-08-14","entity":{"grain":"campaign","id":"campaign_sp_004"},"rule_refs":["R1"],"guardrail_refs":[],"client_id":"demo_client_001","inputs":[{"concept":"acos","value":0.455,"baseline":0.35,"source":"derived_fixture"},{"concept":"ctr","value":0.012,"baseline":0.020,"source":"derived_fixture"}],"expected":{"triggered_rules":[],"disposition":"NO_ACTION"},"notes":"两个严格阈值均取等号。"},

    {"assertion_id":"A-R2-POS","title":"R2 曝光增长超过百分之二十","category":"rule_positive","as_of":"2026-08-07","entity":{"grain":"campaign","id":"campaign_sb_001"},"rule_refs":["R2"],"guardrail_refs":[],"client_id":"demo_client_001","inputs":[{"concept":"impressions_growth","value":0.21,"source":"derived_fixture"}],"expected":{"triggered_rules":["R2"],"action":{"type":"maintain_budget","param":{}},"diagnosis_contains":"增长期","disposition":"MANUAL_CONFIRM","coverage_status":"MATCH"},"assumption_refs":["DA-01"],"notes":"R2 标准成功场景。"},
    {"assertion_id":"A-R2-NEG","title":"R2 曝光增长不足","category":"rule_negative","as_of":"2026-08-07","entity":{"grain":"campaign","id":"campaign_sb_002"},"rule_refs":["R2"],"guardrail_refs":[],"client_id":"demo_client_001","inputs":[{"concept":"impressions_growth","value":0.10,"source":"derived_fixture"}],"expected":{"triggered_rules":[],"disposition":"NO_ACTION"},"notes":"增长不足不触发。"},
    {"assertion_id":"A-R2-BOUNDARY","title":"R2 百分之二十等号不触发","category":"rule_boundary","as_of":"2026-08-07","entity":{"grain":"campaign","id":"campaign_sb_003"},"rule_refs":["R2"],"guardrail_refs":[],"client_id":"demo_client_001","inputs":[{"concept":"impressions_growth","value":0.20,"source":"derived_fixture"}],"expected":{"triggered_rules":[],"disposition":"NO_ACTION"},"notes":"严格大于的边界。"},

    {"assertion_id":"A-R3-POS","title":"R3 MTA ROAS 高于基准","category":"rule_positive","as_of":"2026-08-14","entity":{"grain":"touchpoint","id":"SP:PRODUCT_AD:TOP_OF_SEARCH:STATIC:CLICK"},"rule_refs":["R3"],"guardrail_refs":[],"client_id":"demo_client_001","inputs":[{"concept":"mta_roas","value":1.60,"baseline":1.00,"source":"mta_fixture"}],"expected":{"triggered_rules":["R3"],"action":{"type":"budget_increase","param":{"pct":10}},"diagnosis_contains":"MTA","disposition":"AUTO_EXECUTE","coverage_status":"MATCH"},"notes":"Markov 触点成功场景。"},
    {"assertion_id":"A-R3-NEG","title":"R3 MTA ROAS 不足","category":"rule_negative","as_of":"2026-08-14","entity":{"grain":"touchpoint","id":"SP:PRODUCT_AD:REST_OF_SEARCH:STATIC:CLICK"},"rule_refs":["R3"],"guardrail_refs":[],"client_id":"demo_client_001","inputs":[{"concept":"mta_roas","value":1.40,"baseline":1.00,"source":"mta_fixture"}],"expected":{"triggered_rules":[],"disposition":"NO_ACTION"},"notes":"未超过一点五倍基准。"},
    {"assertion_id":"A-R3-BOUNDARY","title":"R3 一点五倍等号不触发","category":"rule_boundary","as_of":"2026-08-14","entity":{"grain":"touchpoint","id":"SP:PRODUCT_AD:PRODUCT_PAGE:STATIC:CLICK"},"rule_refs":["R3"],"guardrail_refs":[],"client_id":"demo_client_001","inputs":[{"concept":"mta_roas","value":1.50,"baseline":1.00,"source":"mta_fixture"}],"expected":{"triggered_rules":[],"disposition":"NO_ACTION"},"notes":"严格大于的边界。"},

    {"assertion_id":"A-R4-POS","title":"R4 十四日 ROAS 低于一","category":"rule_positive","as_of":"2026-08-14","entity":{"grain":"campaign","id":"campaign_dsp_001"},"rule_refs":["R4"],"guardrail_refs":[],"client_id":"demo_client_001","inputs":[{"concept":"roas","value":0.90,"source":"derived_fixture"}],"expected":{"triggered_rules":["R4"],"action":{"type":"pause_campaign","param":{}},"diagnosis_contains":"ROAS","disposition":"REVIEW","coverage_status":"MATCH"},"assumption_refs":["DA-03"],"notes":"十四日聚合窗口。"},
    {"assertion_id":"A-R4-NEG","title":"R4 ROAS 高于一不触发","category":"rule_negative","as_of":"2026-08-14","entity":{"grain":"campaign","id":"campaign_dsp_002"},"rule_refs":["R4"],"guardrail_refs":[],"client_id":"demo_client_001","inputs":[{"concept":"roas","value":1.10,"source":"derived_fixture"}],"expected":{"triggered_rules":[],"disposition":"NO_ACTION"},"assumption_refs":["DA-03"],"notes":"正常 ROAS 不触发。"},
    {"assertion_id":"A-R4-BOUNDARY","title":"R4 ROAS 等于一不触发","category":"rule_boundary","as_of":"2026-08-14","entity":{"grain":"campaign","id":"campaign_dsp_003"},"rule_refs":["R4"],"guardrail_refs":[],"client_id":"demo_client_001","inputs":[{"concept":"roas","value":1.00,"source":"derived_fixture"}],"expected":{"triggered_rules":[],"disposition":"NO_ACTION"},"assumption_refs":["DA-03"],"notes":"严格小于的边界。"},

    {"assertion_id":"A-R5-POS","title":"R5 低贡献高花费且模型一致","category":"rule_positive","as_of":"2026-08-14","entity":{"grain":"touchpoint","id":"DSP:DISPLAY:UNSPECIFIED:IMAGE:IMPRESSION"},"rule_refs":["R5"],"guardrail_refs":[],"client_id":"demo_client_001","inputs":[{"concept":"contribution_share","value":0.08,"source":"mta_fixture"},{"concept":"spend_share","value":0.25,"source":"derived_fixture"},{"concept":"attribution_divergence","value":0.03,"source":"derived_fixture"}],"expected":{"triggered_rules":["R5"],"action":{"type":"budget_reallocation_experiment","param":{}},"diagnosis_contains":"花费份额","disposition":"REVIEW","coverage_status":"MATCH"},"assumption_refs":["DA-02"],"notes":"三个输入均来自 MTA 输出或透明派生。"},
    {"assertion_id":"A-R5-NEG-CONTRIBUTION","title":"R5 贡献份额不低","category":"rule_negative","as_of":"2026-08-14","entity":{"grain":"touchpoint","id":"DSP:AUDIO:UNSPECIFIED:UNSPECIFIED:IMPRESSION"},"rule_refs":["R5"],"guardrail_refs":[],"client_id":"demo_client_001","inputs":[{"concept":"contribution_share","value":0.12,"source":"mta_fixture"},{"concept":"spend_share","value":0.25,"source":"derived_fixture"},{"concept":"attribution_divergence","value":0.03,"source":"derived_fixture"}],"expected":{"triggered_rules":[],"disposition":"NO_ACTION"},"assumption_refs":["DA-02"],"notes":"仅破坏贡献份额条件。"},
    {"assertion_id":"A-R5-NEG-SPEND","title":"R5 花费份额不高","category":"rule_negative","as_of":"2026-08-14","entity":{"grain":"touchpoint","id":"DSP:ONLINE_VIDEO:UNSPECIFIED:VIDEO:IMPRESSION"},"rule_refs":["R5"],"guardrail_refs":[],"client_id":"demo_client_001","inputs":[{"concept":"contribution_share","value":0.08,"source":"mta_fixture"},{"concept":"spend_share","value":0.18,"source":"derived_fixture"},{"concept":"attribution_divergence","value":0.03,"source":"derived_fixture"}],"expected":{"triggered_rules":[],"disposition":"NO_ACTION"},"assumption_refs":["DA-02"],"notes":"仅破坏花费份额条件。"},
    {"assertion_id":"A-R5-NEG-DIVERGENCE","title":"R5 模型归因差异过大","category":"rule_negative","as_of":"2026-08-14","entity":{"grain":"touchpoint","id":"DSP:STREAMING_TV:UNSPECIFIED:VIDEO:IMPRESSION"},"rule_refs":["R5"],"guardrail_refs":[],"client_id":"demo_client_001","inputs":[{"concept":"contribution_share","value":0.08,"source":"mta_fixture"},{"concept":"spend_share","value":0.25,"source":"derived_fixture"},{"concept":"attribution_divergence","value":0.08,"source":"derived_fixture"}],"expected":{"triggered_rules":[],"disposition":"NO_ACTION"},"assumption_refs":["DA-02"],"notes":"仅破坏模型差异条件。"},